{
  "schema_version": "1.0",
  "skill": "tw-edu-official-document",
  "language": "zh-TW",
  "context": {
    "subject": "教育行政",
    "grade": "國民中學",
    "topic": "函報研習成果與經費結報"
  },
  "sources": [
    {
      "title": "承辦人提供之研習成果與經費資料",
      "status": "user_provided"
    },
    {
      "title": "行政院文書處理手冊（112.06.08 修正）",
      "status": "verified"
    }
  ],
  "content": {
    "title": "函報教師專業成長研習成果（範例）",
    "mode": "撰寫",
    "doc_type": "函",
    "direction": "上行",
    "issuer": "○○市立○○國民中學",
    "recipient": "○○市政府教育局",
    "handling": "簽稿併陳",
    "date": "〔待確認：發文日期〕",
    "doc_number": "〔待確認：發文字號〕",
    "speed": "普通件",
    "attachments": [
      "成果報告1份",
      "經費收支結算表1份"
    ],
    "subject": "檢陳本校辦理「生成式人工智慧融入教學」教師專業成長研習成果報告及經費收支結算表各1份，請鑒核。",
    "explanation": [
      "依鈞局115年○月○日○○字第○○○號函辦理。",
      "本研習於115年9月24日辦理，參加教師42人，研習時數3小時。",
      "核定補助經費新臺幣1萬5,000元，實支新臺幣1萬4,820元，賸餘款新臺幣180元依規定繳回。"
    ],
    "proposal_label": "無",
    "proposal": [],
    "cc": {
      "original": [
        "○○市政府教育局"
      ],
      "copy": [
        "本校教務處",
        "本校會計室"
      ]
    },
    "pending": [
      "鈞局原函日期與字號",
      "賸餘款繳回方式依原核定函規定確認"
    ]
  }
}
